<?xml version='1.0' encoding='UTF-8'?>
<?xml-stylesheet media="screen"              title="Dictionary view"   href="../../giella-core/dicts/scripts/gt_dictionary_XXE.css"     type="text/css"?>
<?xml-stylesheet media="screen"              title="Hierarchical view" href="../../giella-core/dicts/scripts/gt_dictionary_XXE_alt.css" type="text/css" alternate="yes" ?>
<?xml-stylesheet media="print,tv,projection" title="Dictionary view"   href="../../giella-core/dicts/scripts/gt_dictionary.css"         type="text/css"?>
<?xml-stylesheet media="print,tv,projection" title="Hierarchical view" href="../../giella-core/dicts/scripts/gt_dictionary_alt.css"     type="text/css" alternate="yes" ?>
<!DOCTYPE r PUBLIC "-//DivvunGiellatekno//DTD Dictionaries//Multilingual" "../dtd/nobfkv.dtd">
<r xml:lang="nob">
   <lics>
      <lic xml:lang="en">
This code is made available under a Creative Commons Attribution license
<a>http://creativecommons.org/licenses/by/3.0/no/deed.en</a>.

You are free to copy, distribute and adapt the work, as long as you always give
proper attribution using the attribution text below.

For the full license text, see the link above.</lic>
      <ref>Work by Terje Aronsen and Verena Schall at Kainun institutti, Giellatekno at UiT, Divvun at the Norwegian Saami Parliament,
          and members of the language communities. Source code
          available at <a>https://victorio.uit.no/langtech/trunk/</a>.</ref>
      <sourcenote>
     THIS TEXT IS THE ORIGINAL SOURCE CODE. This is NOT a fully styled and
     published dictionary. As such it can and
     will contain unfinished entries, unpublished entries, entries with
     objectionable translations, etc. If you find any errors or want to add more
     words, download the file, edit it, and send it back to
     <a>mailto:divvun@samediggi.no</a> and <a>mailto:giellatekno@hum.uit.no</a>.
     Please also note that the entries are not necessarily sorted,
     or could be wrongly sorted.
     </sourcenote>
   </lics>
          <e src="anb">
        <lg>
         <l t_type="Phrase">lete etter nåla i høystakken</l>
      </lg>
      <mg>
         <tg xml:lang="fkv">
         <t t_type="Phrase">hakkeet neulaa heinäsaurasta</t>
         <t t_type="Phrase">hakkeet äimää heinäsaurasta</t>
         </tg>
      </mg>
   </e>
   <e src="anb">
      <lg>
         <l t_type="Phrase">med åpne armer</l>
      </lg>
      <mg>
         <tg xml:lang="fkv">
            <t t_type="Phrase">aukkein sylin</t>
         <xg>
            <x>Han tok meg imot med åpne armer.</x>
            <xt>Hän otti minun vasthaan aukkein sylin.</xt>
         </xg>
         </tg>
      </mg>
   </e>
   <e src="anb">
      <lg>
         <l t_type="Phrase">med åpent sinn</l>
      </lg>
      <mg>
         <tg xml:lang="fkv">
            <t t_type="Phrase">aukkein mielin</t>
         </tg>
      </mg>
   </e>
   <e src="anb">
      <lg>
         <l t_type="Phrase">med nebb og klør</l>
      </lg>
      <mg>
         <tg xml:lang="fkv">
            <t t_type="Phrase">kynsin hamphain</t>
         </tg>
      </mg>
   </e>
   <e src="es">
      <lg>
         <l t_type="Phrase">dette av lasset</l>
      </lg>
      <mg>
         <tg xml:lang="fkv">
            <t t_type="Phrase">puđota matkasta</t>
            <xg>
               <x>Nå datt jeg av lasset, kan du forklare på nytt?</x>
               <xt>Nyt mie putosin matkasta, saattaisitko selittäät uuđesti?</xt>
            </xg>
         </tg>
      </mg>
   </e>
   <e src="es">
      <lg>
         <l t_type="Phrase">ramle av lasset</l>
      </lg>
      <mg>
         <tg xml:lang="fkv">
            <t t_type="Phrase">puđota matkasta</t>
            <xg>
               <x>Nå ramlet jeg av lasset, kan du forklare på nytt?</x>
               <xt>Nyt mie putosin matkasta, saattaisitko selittäät uuđesti?</xt>
            </xg>
         </tg>
      </mg>
   </e>
   <e src="es">
      <lg>
         <l t_type="Phrase">falle av lasset</l>
      </lg>
      <mg>
         <tg xml:lang="fkv">
            <t t_type="Phrase">puđota matkasta</t>
            <xg>
               <x>Nå falt jeg av lasset, kan du forklare på nytt?</x>
               <xt>Nyt mie putosin matkasta, saattaisitko selittäät uuđesti?</xt>
            </xg>
         </tg>
      </mg>
   </e>
   <e src="es">
      <lg>
         <l t_type="Phrase">miste tråden</l>
      </lg>
      <mg>
         <tg xml:lang="fkv">
            <t t_type="Phrase">puđota matkasta</t>
            <xg>
               <x>Nå mistet jeg tråden, kan du forklare på nytt?</x>
               <xt>Nyt mie putosin matkasta, saattaisitko selittäät uuđesti?</xt>
            </xg>
         </tg>
      </mg>
   </e>
   <e src="anb">
      <lg>
         <l t_type="Phrase">legge i jern</l>
      </lg>
      <mg>
         <tg xml:lang="fkv">
            <t t_type="Phrase">panna rauthoin</t>
            <xg>
               <x>Politiet la forbryteren i jern.</x>
               <xt>Pulettija pani rikolisen rauthoin.</xt>
            </xg>
         </tg>
      </mg>
   </e>
   <e src="ai">
      <lg>
         <l t_type="Phrase">og så videre</l>
      </lg>
      <mg>
         <tg xml:lang="fkv">
            <t t_type="Phrase">ja niin eđespäin</t>
            <t t_type="Phrase">ja niin poispäin</t>
         </tg>
      </mg>
   </e>
   <e src="anb">
      <lg>
         <l t_type="Phrase">i manns minne</l>
      </lg>
      <mg>
         <tg xml:lang="fkv">
            <t pos="Adv">miesmuisthiin</t>
         </tg>
      </mg>
   </e>
   <e src="anb">
      <lg>
         <l t_type="Phrase">med en gang</l>
      </lg>
      <mg>
         <tg xml:lang="fkv">
            <t t_type="Phrase">yhtä mennoo</t>
         </tg>
      </mg>
   </e>
      <e src="ki">
      <lg>
         <l t_type="Phrase">lyse fred</l>
      </lg>
      <mg>
         <tg xml:lang="fkv">
            <t t_type="Phrase">toivottaat rauhaa</t>
             <xg>
               <x>Vi lyser fred over hans minne.</x>
               <xt>Met toivotamma rauhaa hänen muistole.</xt>
            </xg>
         </tg>
      </mg>
   </e>
         <e src="ki">
      <lg>
         <l t_type="Phrase">hvil i fred</l>
      </lg>
      <mg>
         <tg xml:lang="fkv">
            <t t_type="Phrase">levätä rauhassa</t>
             <xg>
               <x>Hvil i fred, bestemor.</x>
               <xt>Leppää rauhassa, ämmi.</xt>
            </xg>
               <xg>
               <x>Hvil i fred, modige barn.</x>
               <xt>Leväkkää rauhassa, rohkeet lapset. </xt>
            </xg>
         </tg>
      </mg>
   </e>
   <e src="es">
      <lg>
         <l t_type="Phrase">ikke være tørr bak ørene</l>
      </lg>
      <mg>
         <tg xml:lang="fkv">
            <t t_type="Phrase">olla korvatakuset kuivat</t>
            <xg>
               <x>Han er ikke tørr bak ørene en gang.</x>
               <xt>Hänelä ei ole korvantakusetkhaan kuivat.</xt>
            </xg>
         </tg>
      </mg>
   </e>
</r>
